{
  "schema_version": 1,
  "profile_id": "weekly-l5-recovery",
  "seed": 50501,
  "expected_outcome": "recovered",
  "delayed_calls": [
    {
      "target": "harness::send",
      "delay_ms": 1250,
      "occurrences": 2
    }
  ],
  "fail_first_attempt": [
    "coordination-child-2"
  ],
  "duplicate_events": true,
  "child_timeout_ms": 15000,
  "transient_disconnect": {
    "target": "subject-transport",
    "after_action": "first-child-started",
    "duration_ms": 2500
  },
  "out_of_order_results": true,
  "max_work_amplification": 5.0
}
